{
  "id": "npc_race_organizer",
  "name": "Rex \"Speed\" Danner",
  "species": "human",
  "occupation": "Race Organizer",
  "factionId": "smugglers_guild",
  "location": {
    "planet": "tatooine",
    "area": "mos_eisley",
    "x": 415,
    "y": 385
  },
  "npcType": "quest_giver",
  "isCompanion": false,
  "dialogue": {
    "greeting": {
      "stranger": "You look like you know how to handle a swoop bike. Interested in a real challenge?",
      "acquaintance": "Back for the race? Good, we need more competitors.",
      "friend": "My friend! The race is going to be legendary. You're in, right?",
      "confidant": "You're one of the best pilots I've seen. This race was made for you."
    },
    "questRelated": {
      "sg_tatooine_race_01_registration": "The Beggar's Canyon Championship! It's the biggest swoop race on Tatooine. Pilots from across the Outer Rim come to compete. The prize? 10,000 credits and a custom-built swoop bike. But it's dangerous—Beggar's Canyon is no joke. You'll need skill, guts, and a fast bike. Think you've got what it takes?"
    },
    "general": [
      "Swoop racing is the purest form of competition. Man, machine, and the desert.",
      "I've organized races for twenty years. This one's going to be special.",
      "The best pilots in the galaxy will be here. Are you ready to face them?",
      "Beggar's Canyon has claimed many pilots. Make sure you're not one of them.",
      "The race isn't just about speed. It's about survival."
    ]
  },
  "quests": ["sg_tatooine_race_01_registration"],
  "vendorInventory": null,
  "companionAbilities": null,
  "companionStats": null,
  "appearance": {
    "age": "mid 40s",
    "build": "athletic",
    "hair": "blond, styled",
    "eyes": "blue",
    "distinguishingFeatures": "Pilot's goggles around neck, racing jacket, confident smile, mechanical left hand"
  },
  "biography": "Rex Danner, known as 'Speed' to his friends, is a former swoop racer who now organizes the most prestigious races on Tatooine. He lost his hand in a racing accident years ago but never lost his passion for the sport. He's charismatic, knows everyone in the racing community, and puts together events that draw pilots from across the galaxy. He's fair, but he also knows how to create drama and excitement.",
  "isAvailable": true,
  "personalityTraits": {
    "empathy": 45,
    "formality": 25,
    "humor": 70,
    "trust": 50
  }
}



