{
  "id": "npc_jax_riven",
  "name": "Jax Riven",
  "species": "human",
  "occupation": "Former Compound Resident",
  "factionId": "independent_investigators",
  "location": {
    "planet": "solenne",
    "area": "refugee_settlement",
    "x": 125,
    "y": 90
  },
  "npcType": "companion",
  "isCompanion": true,
  "dialogue": {
    "greeting": {
      "stranger": "I don't talk about the compound. Not to strangers.",
      "acquaintance": "You're persistent. Maybe you're worth talking to.",
      "friend": "My friend, you've earned my trust. I'll tell you what I know.",
      "confidant": "You're the only one I've told the whole story to. Thank you for listening."
    },
    "questRelated": {
      "iia_main_01_compound_investigation": "I was a teenager when I arrived at Compound 7-Alpha. My family was killed in a Dominion raid, and I was taken. The compound... it wasn't just a detention facility. They were doing experiments. I don't know what, exactly, but I saw things. Things that still haunt me. I escaped, but many didn't. If you're investigating, I'll help. But be careful. The people who ran that place are still out there."
    },
    "general": [
      "The compound took everything from me. But it didn't break me.",
      "I've learned to fight. To survive. That's all that matters now.",
      "Mira and I... we're the lucky ones. We got out.",
      "Dr. Voss has been helping us. She's a good person.",
      "I don't trust easily. But you've proven yourself."
    ]
  },
  "quests": ["iia_main_01_compound_investigation"],
  "vendorInventory": null,
  "companionAbilities": {
    "combat": ["aggressive_strike", "tactical_advance"],
    "utility": ["survival", "stealth"]
  },
  "companionStats": {
    "health": 90,
    "damage": 20,
    "defense": 12,
    "specialization": "combat"
  },
  "appearance": {
    "age": "early 20s",
    "build": "athletic, lean",
    "hair": "dark, short",
    "eyes": "intense brown",
    "distinguishingFeatures": "Scar on right shoulder, haunted eyes, defensive posture, always alert"
  },
  "biography": "Jax Riven was a teenager when he was taken to Compound 7-Alpha after his family was killed in a Dominion raid. He spent years in the compound, witnessing things that left him scarred both physically and emotionally. He's tough, resourceful, and has learned to fight to survive. He escaped the compound with Mira Kess and others, and now works with the Independent Investigators Alliance to expose what happened. He's a potential companion, offering combat skills and survival expertise, but he's also deeply traumatized and struggles with trust.",
  "isAvailable": true,
  "personalityTraits": {
    "empathy": 50,
    "formality": 30,
    "humor": 15,
    "trust": 35
  }
}



