{
  "id": "npc_jedi_scholar",
  "name": "Scholar Tera Voss",
  "species": "human",
  "occupation": "Jedi Scholar",
  "factionId": "jedi_seekers",
  "location": {
    "planet": "coruscant",
    "area": "temple_district",
    "x": 505,
    "y": 305
  },
  "npcType": "quest_giver",
  "isCompanion": false,
  "dialogue": {
    "greeting": {
      "stranger": "You're drawn to the Temple, aren't you? I can sense it.",
      "acquaintance": "You return to study. Good. The Temple has much to teach.",
      "friend": "My friend, your understanding of the Force grows. I'm proud.",
      "confidant": "You've become a true scholar of the Force. The Temple's secrets await you."
    },
    "questRelated": {
      "js_coruscant_01_ruined_temple": "The Jedi Temple... it was the heart of the Jedi Order. Now it's a ruin, a monument to what was lost. But the Force remains. I've been studying the Temple for years, and I believe there's an artifact still hidden within—something the Empire missed. It's dangerous to enter, filled with traps and Imperial remnants, but I think you're meant to find it. Will you help me recover it?",
      "js_coruscant_01_ruined_temple_location": "The Jedi Temple is in the Temple District. You'll need to reach the inner sanctum—the deepest part of the temple where the artifact is hidden. The path is treacherous, and there's a guardian protecting it. But if you can reach depth zone 4 and defeat the guardian, the artifact will be yours. Be careful—the temple remembers, and it will test you."
    },
    "general": [
      "The Temple remembers. The Force remembers. We must remember too.",
      "The Empire tried to destroy everything, but some things can't be destroyed.",
      "To understand the Jedi, we must understand the Temple.",
      "The artifact I seek... it could change everything. Or it could destroy us.",
      "The Force guides those who listen. Are you listening?"
    ]
  },
  "quests": ["js_coruscant_01_ruined_temple"],
  "vendorInventory": null,
  "companionAbilities": null,
  "companionStats": null,
  "appearance": {
    "age": "early 30s",
    "build": "scholarly, graceful",
    "hair": "auburn, long",
    "eyes": "intelligent green",
    "distinguishingFeatures": "Scholar's robes, datapad with Temple research, Force-sensitive aura, passionate expression"
  },
  "biography": "Scholar Tera Voss is a Jedi Seeker who has dedicated her life to studying the Jedi Temple on Coruscant. She's not a fighter—she's a researcher, a historian, a seeker of knowledge. She's spent years studying the Temple's architecture, its history, and the Force signatures that still linger within. She believes there's an artifact hidden deep in the Temple, something the Empire missed during their purge. She's passionate, knowledgeable, and deeply connected to the Force, but she needs someone with more practical skills to help her recover the artifact.",
  "isAvailable": true,
  "personalityTraits": {
    "empathy": 70,
    "formality": 50,
    "humor": 30,
    "trust": 60
  }
}


