{
  "id": "npc_senate_lobbyist",
  "name": "Senator Aris or Corporate Rep",
  "species": "human",
  "occupation": "Senator or Corporate Representative",
  "factionId": "new_republic",
  "location": {
    "planet": "coruscant",
    "area": "senate_district",
    "x": 495,
    "y": 495
  },
  "npcType": "quest_giver",
  "isCompanion": false,
  "dialogue": {
    "greeting": {
      "stranger": "I represent important interests. Perhaps we can help each other.",
      "acquaintance": "You've been useful. I have another task for you.",
      "friend": "My friend, you understand how politics works. I appreciate that.",
      "confidant": "You've become a valuable ally. Together, we can accomplish great things."
    },
    "questRelated": {
      "coruscant_side_02_senate_lobbying": "The Senate is voting on an important bill. My... constituents have a strong interest in the outcome. I need someone to help influence the vote. It's all perfectly legal—just some strategic conversations, a few favors called in. The New Republic runs on relationships, and I need someone who understands that. Can you help me ensure the right outcome?"
    },
    "general": [
      "Politics is about relationships. Build the right relationships, and you can accomplish anything.",
      "The Senate is a machine. You just need to know which buttons to push.",
      "Every vote matters. Every relationship matters.",
      "The New Republic is still finding its way. We can help shape it.",
      "Credits make the galaxy go round. But influence makes it go round faster."
    ]
  },
  "quests": ["coruscant_side_02_senate_lobbying"],
  "vendorInventory": null,
  "companionAbilities": null,
  "companionStats": null,
  "appearance": {
    "age": "mid 40s",
    "build": "well-groomed, professional",
    "hair": "brown, styled",
    "eyes": "shrewd brown",
    "distinguishingFeatures": "Expensive clothing, polished appearance, confident smile, always networking"
  },
  "biography": "This NPC can represent either a New Republic senator or a Corporate Sector representative, depending on player choices. They're a skilled politician/lobbyist who understands how the Senate works and how to influence votes. They're not necessarily corrupt—they're just pragmatic about how politics works. They represent the gray area between legitimate political influence and corruption, and they offer players a chance to engage with the political system.",
  "isAvailable": true,
  "personalityTraits": {
    "empathy": 40,
    "formality": 70,
    "humor": 50,
    "trust": 40
  }
}



