{
  "id": "npc_syndicate_leader",
  "name": "Vorak Kresh",
  "species": "human",
  "occupation": "Syndicate Leader",
  "factionId": null,
  "location": {
    "planet": "ryloth",
    "area": "lessu",
    "x": 580,
    "y": 420
  },
  "npcType": "enemy",
  "isCompanion": false,
  "dialogue": {
    "greeting": {
      "stranger": "You've been asking too many questions. That's dangerous.",
      "acquaintance": "I warned you to stay away. You didn't listen.",
      "friend": "You think you can befriend me? I don't have friends, only assets and enemies.",
      "confidant": "You've made a mistake coming here. This ends now."
    },
    "questRelated": {
      "iia_ryloth_04_syndicate_exposure": "So, you think you can expose me? You're a fool. The syndicate has connections throughout the galaxy. The Empire paid us well to keep quiet about Compound 7-Alpha, and we'll be paid even more to silence you. This ends now."
    },
    "general": [
      "Business is business. I don't make the rules, I just profit from them.",
      "The New Republic? They're weak. They can't stop us.",
      "You meddle in things you don't understand. That will be your undoing.",
      "The galaxy runs on credits and fear. I provide both."
    ]
  },
  "quests": ["iia_ryloth_04_syndicate_exposure"],
  "vendorInventory": null,
  "companionAbilities": null,
  "companionStats": {
    "health": 200,
    "damage": 35,
    "defense": 20,
    "specialization": "combat"
  },
  "appearance": {
    "age": "early 50s",
    "build": "imposing",
    "hair": "gray, well-groomed",
    "eyes": "cold blue",
    "distinguishingFeatures": "Expensive clothing, cybernetic left eye, always surrounded by guards"
  },
  "biography": "Vorak Kresh is the ruthless leader of the criminal syndicate that controls Ryloth's mining operations. A former Imperial officer who turned to crime after the Empire's fall, he's built a profitable operation through intimidation, bribery, and violence. He has connections to the Imperial Remnant and has been paid handsomely to keep quiet about Compound 7-Alpha. He's intelligent, cruel, and will stop at nothing to protect his interests.",
  "isAvailable": true,
  "personalityTraits": {
    "empathy": 10,
    "formality": 70,
    "humor": 5,
    "trust": 5
  }
}

