{
  "id": "npc_hutt_lieutenant",
  "name": "Grakka the Hutt",
  "species": "hutt",
  "occupation": "Hutt Lieutenant",
  "factionId": null,
  "location": {
    "planet": "tatooine",
    "area": "dune_sea",
    "x": 610,
    "y": 210
  },
  "npcType": "quest_giver",
  "isCompanion": false,
  "dialogue": {
    "greeting": {
      "stranger": "Ah, a new face. You seek profit, yes? I have opportunity for you.",
      "acquaintance": "You return. Good. I have more work for you.",
      "friend": "My friend, you serve me well. I reward loyalty handsomely.",
      "confidant": "You are trusted. I share with you great opportunity."
    },
    "questRelated": {
      "tatooine_side_02_jabba_legacy": "Jabba's Palace... it sits empty now, but it is not empty of value. My master's treasures remain within, protected by traps and guardians. I offer you a deal: enter the palace, recover the treasures, and bring them to me. I will pay you well—30% of the value. But be warned: the palace is dangerous. Many have tried. Few have succeeded. Do you have the courage?"
    },
    "general": [
      "Jabba was great Hutt. His legacy must be preserved... and profited from.",
      "The palace holds many secrets. And many credits.",
      "I reward those who serve me well. Betray me, and you will regret it.",
      "The Hutt Cartel remembers its friends. And its enemies.",
      "Profit is the only true loyalty. Everything else is sentiment."
    ]
  },
  "quests": ["tatooine_side_02_jabba_legacy"],
  "vendorInventory": null,
  "companionAbilities": null,
  "companionStats": null,
  "appearance": {
    "age": "middle-aged (for a Hutt)",
    "build": "large (Hutt physique)",
    "hair": "n/a",
    "eyes": "yellow",
    "distinguishingFeatures": "Traditional Hutt appearance, expensive jewelry, surrounded by guards and servants"
  },
  "biography": "Grakka is a Hutt lieutenant who has taken over some of Jabba's former operations on Tatooine. He's ambitious, greedy, and sees opportunity in Jabba's abandoned palace. He's not as powerful as Jabba was, but he's building his own criminal empire. He's pragmatic—he'll work with anyone who can make him credits, but he's also ruthless and will eliminate anyone who becomes a threat. He represents the continuation of Hutt power on Tatooine.",
  "isAvailable": true,
  "personalityTraits": {
    "empathy": 15,
    "formality": 40,
    "humor": 30,
    "trust": 20
  }
}

