{
  "id": "npc_local_historian",
  "name": "Professor Aris Thorne",
  "species": "human",
  "occupation": "Historian",
  "factionId": null,
  "location": {
    "planet": "gravenmoor",
    "area": "greywell",
    "x": 420,
    "y": 410
  },
  "npcType": "quest_giver",
  "isCompanion": false,
  "dialogue": {
    "greeting": {
      "stranger": "Ah, a fellow seeker of knowledge! How can I help you?",
      "acquaintance": "Back to learn more? Excellent!",
      "friend": "My friend, you appreciate history. That's rare these days.",
      "confidant": "You understand the importance of preserving history. I trust you with this knowledge."
    },
    "questRelated": {
      "gravenmoor_side_01_marn_homestead": "The Marn Homestead... it's one of the most significant historical sites on Gravenmoor, though most people don't realize it. That's where Dav Marn grew up. The farm is abandoned now, but it holds secrets. I've been trying to get permission to explore it, but the local authorities won't allow it. However, if someone were to... investigate it independently, I'd be very interested in what they might find. I'd pay well for any historical artifacts or information."
    },
    "general": [
      "Gravenmoor has more history than people realize. Most of it is buried in the sand.",
      "Dav Marn changed the galaxy, and it all started here, on this backwater planet.",
      "The Iron Dominion tried to erase history. We must preserve it.",
      "Every artifact tells a story. We just need to listen.",
      "The Marn Homestead is a monument to ordinary people who did extraordinary things."
    ]
  },
  "quests": ["gravenmoor_side_01_marn_homestead"],
  "vendorInventory": null,
  "companionAbilities": null,
  "companionStats": null,
  "appearance": {
    "age": "mid 50s",
    "build": "scholarly, slight",
    "hair": "gray, neatly trimmed",
    "eyes": "brown, intelligent",
    "distinguishingFeatures": "Glasses, scholarly robes, datapad always in hand, excited expression when discussing history"
  },
  "biography": "Professor Aris Thorne is a historian who has dedicated his life to preserving the history of Gravenmoor and the Marn legacy. He's not a Keeper Seeker, but he's fascinated by the Veil and its role in galactic history. He's passionate, knowledgeable, and willing to bend the rules to preserve historical artifacts. He represents the importance of remembering the past, especially in a galaxy that's trying to move forward.",
  "isAvailable": true,
  "personalityTraits": {
    "empathy": 60,
    "formality": 50,
    "humor": 40,
    "trust": 50
  }
}



